{
  "$schema": "https://json-schema.org/draft/2020-12/schema",
  "$id": "https://crud-platform.local/contracts/integration/schema/envelope.schema.json",
  "type": "object",
  "required": ["eventId", "type", "version", "aggregateType", "aggregateId", "occurredAt", "correlationId", "causationId", "payload"],
  "additionalProperties": false,
  "properties": {
    "eventId": {"type": "string", "format": "uuid"},
    "type": {"type": "string", "pattern": "^[a-z]+(?:\\.[a-z]+)+$"},
    "version": {"type": "integer", "minimum": 1},
    "aggregateType": {"type": "string", "pattern": "^[a-z]+(?:_[a-z]+)*$"},
    "aggregateId": {"type": "string", "format": "uuid"},
    "occurredAt": {"type": "string", "format": "date-time"},
    "correlationId": {"type": "string", "format": "uuid"},
    "causationId": {"type": ["string", "null"], "format": "uuid"},
    "payload": {"type": "object"}
  }
}
