{"eventId":"00000000-0000-4000-8000-000000000009","type":"inventory.reservation.released","version":1,"aggregateType":"inventory_reservation","aggregateId":"00000000-0000-4000-8000-000000000019","occurredAt":"2026-07-29T12:00:00+00:00","correlationId":"00000000-0000-4000-8000-000000000019","causationId":null,"payload":{}}
