{"eventId":"00000000-0000-4000-8000-000000000020","type":"payment.invoice.paid","version":1,"aggregateType":"payment_invoice","aggregateId":"00000000-0000-4000-8000-000000000021","occurredAt":"2026-07-30T12:00:00+00:00","correlationId":"00000000-0000-4000-8000-000000000021","causationId":null,"payload":{}}
