{"eventId":"00000000-0000-4000-8000-000000000005","type":"inventory.reservation.requested","version":1,"aggregateType":"store_order","aggregateId":"00000000-0000-4000-8000-000000000015","occurredAt":"2026-07-29T12:00:00+00:00","correlationId":"00000000-0000-4000-8000-000000000015","causationId":null,"payload":{}}
