{"eventId":"00000000-0000-4000-8000-000000000010","type":"store.directory.upserted","version":1,"aggregateType":"store","aggregateId":"00000000-0000-4000-8000-000000000020","occurredAt":"2026-07-30T12:00:00+00:00","correlationId":"00000000-0000-4000-8000-000000000010","causationId":null,"payload":{"storeUuid":"00000000-0000-4000-8000-000000000020","code":"xuhui","name":"Xuhui Store","status":"active"}}
